,name,reviews,score,year,month,day
2,JB L,게임후기 및 Tip 1. 주점에서 전설이 나왔다고 해서 3배 달리면 거의 후회함 주점은 쓰레기가 없을때 즉 쓸만한게 3마리 나왔을 때만 3장 쓰고 나머지는 적당히 (확률3/1아님 주작있음)체감상 10번중에 1번 성공할까말까? 2. 나무랑 크리스탈 끝판보스 잡고 업글도 하고나니 쓸데가 없다. 3. 과금 광고제거는 쓸만한데 나머지는 글쎄 미완성된 게임 출시한거 같은 느낌임 컨텐츠 부족+확률 주작+캐릭 스킬쿨탐 미표기 등등 편의성이 아직까지 미흡하다. 4. 첨엔 재밌었는데 지금은 퀘스트 숙제하고나면 할게 없네요 좋은 게임인데 좀더 개발해서 출시했으면 하는 아쉬움이 남는 게임 입니다. 확률 표기도 필요할듯 하네요 조금만 해봐도 확률조작 티 많이납니다.,2,2023,4,18
3,Gwang Hyek Na,"게임성은 좋지만 미완성으로 내놓은 게임 몇달 혹은 몇년후, 게임이 완성되면 해라 밑부분은 게임사에 하고싶은말 아직 방치형으로 만들지 컨트롤하는 게임으로 만들지 정하지 못하신건가 싶다 초원의 구슬 - 드랍율을 낮추고 보상을 크게 늘리던가 다른걸 주던가. 보너스 느낌이라기엔 너무짜다 고기, 나무 - 필요한 순간에 부족하거나 없고 갑자기 많은양을 요구한다. 기본적인 육성루트를 따르면서 '보통 이때쯤 몇개가 필요하다' 라는걸 계산안하고 그냥 만들어두기만 한거같다 사냥 - 방치형으로 만들꺼면 ai가 좋던가 컨트롤하게 만들꺼면 컨트롤이 의미가 있던가. 둘다 애매해서 짜증만 난다 뽑기 - 만든사람 반성해라. 게임이 나한테 이렇게 말하는거 같다. ""니가 띄운 전설영웅 30분되기전에 캐쉬안지르면 초기화되서 날라가는데? 안질러?"" 그냥 영웅 저장버튼 하나 만들어라. 돈쓰는 유저만 남길생각이면 계속 유지하면 될듯. 근데 무과금유저가 없는 게임은 어케되는지 아시죠? 게임은 좋은데 너무 아쉽다.",2,2023,4,16
4,독고,"초반에는 재밌었음, 근데 레벨에 따른 던전 난이도가 너무 확 올라가서 던전 돌기 싫어짐.. 던전을 돌아야 붉은보석 수급이 되는데 업좀 했다고 균열보다 난이도 배 이상 높아짐 갑자기... 그리고 던전에서 나오는 템은 최종적으로 균열에 비해 성능이 죄다 구린데 도는 이유는 붉은보석+돈만 파밍하러 가야하는데 난이도 저러니...이 부분은 리뷰에도 여러명이 써놨네.. 그리고 균열을 왜 초기화하는지? 열심히 올라가면 뭐함 초기화되서 옵션 다 바뀌는데 노가다 할 이유도 없고 그걸 일주일마다 매번 해야한다? 노답임",2,2023,3,15
5,아그작,게임 3일째 하는 유저입니다. 총합 60만원쯤 과금했습니다. 3일하면서 느낀점은. 우선 게임이 과금을 안하면 조온나게 힘들 프로그램으로 되어있습니다. 그리고 컨텐츠가 조온나게 없습니다. 그냥 3일째 일반 몹 때려잡는거 보면서 렙업한게 다입니다. 4번째 과금유도 오집니다. 돈안지르고 렙업이 너무 힘듬,2,2023,4,11
6,성진경,초반에 재미있어 소과금으로 시작하였는데 지날수록 과금 없이는 답이 없는것 같다 - 초반에는 퀘스트도 잘 밀리니 골드도 많이 벌리고 뽑기를 하면 전설 등급도 좀 뽑히는것 같아 할만한 게임 같이 느껴진다 - 성장이 정체되는 시점에 뽑기를 하려고 없는 골드 모아서 뽑으려 보면 전설이 나와도 더럽게 선택이 안된다 결국 보석과 골드가 많아야 두번 재선택해서 전설을 얻을수 있는데 특히 재선택하는 재료인 초록 보석은 과금 밖에 거의 답이 없다 - 근데 이 시점이 너무 빨리와서 나 같은 사람은 2일차에 폐사한다 - 뽑기 시스템도 재화쓰거나 30분을 기다려 리셋해야되서 지친다 - 겜은 맘에 드는데 시간과 과금이 지나치게 강요되는것 같다 - 뽑기 재미도 없고 한계도 빨리 오는 겜이다,2,2023,4,2
7,하카타,색다른 재미가 있지만 전체적으로 보완할게 많음.. 우선 레벨업 한거치곤 생각보다 성장했다는 느낌이 너무 낮음 근딜은 40가까이 올려도 돌진하면 그냥 녹음 성장했단 느낌보다 용병수 빨이 50퍼 이상 차지함 그렇다고 빨간보석 수급이 좋은것도 아님 처음엔 혜자과금인줄 알았는데 차차 창렬인게 보임 문양 시스템은 디x4 전설탬마냥 특수옵션이 있지만 옵션도 생각보다 구리면서 하나만 낄수 있는데 또 그걸 패키지로 묶어서 파는거보면 과장됐다는걸 느낌 스텟은 장착만 적용되더라도 특수옵션은 소지만으로 발동되는게 맞음 아니면 용병수의 반정도라도 장착해야 밸런스가 맞음 이래저래 수정할것도 컨텐츠도 안늘리면 그냥 지나가는 게임이 될수밖에 봄맞이 이벤트 진짜 쪼잖아네 이미 만렙은 나무든 광석이든 의미도 없는데 벗꽃땜의미없는 채집을 해야되고 게다가 15일에 총 1500잎인데 상점목록 전부 구매하기엔 턱없이 부족한수치인데.. 이왕 줄꺼면 다 주던가... 진짜 갈수록 정떨어지는 게임이네 x신키우기 반만 닮았음,2,2023,4,8
8,RS J,초반에는 영웅도 잘 나오고 좋은 케릭이 나오는 듯 하다가 어느 시점부터 아예 영웅 선택이 회피됨. (확률이 확 떨어짐) 단지 주점을 통해서는 영웅 레벨을 올리기가 힘들고 용병단 50레벨 이후로는 현질러가 아닌 이상 던전등의 난이도가 올러가 진행이 힘듬. 과금을 추가로 하기엔 엔드 컨텐츠가 없음. 커뮤니티 부재. 40레벨 이후 균열컨텐츠가 나오나 이또한 별 의미가 없음. (보상이 아주 작음) 즉 현질은 하지말고 소소하게 재미보고 지우길 추천. 한 20-30 소소허게 지른 현질러 씀.,2,2023,3,6
9,삐용 (궁둥),"원래 5점줬다가 수정함 갑자기 확 어려워지는 난이도, 무조건 셋중 제일 등급이 낮은 유닛이 뽑히는 극악한 뽑기는 확률고지도 안 되어있음. 또 광고제거를 샀음에도 별 쓸모가 없어서 돈 아까움. 그리고 목재와 돌같은 재화는 점점 쓸모없어지고 남아돌기만 함. 첨엔 재밌었는데 점점 반복되고 정체되는 성장에 지루해짐.",2,2023,3,12
10,김정석,게임 자체는 나쁘지 않게 했습니다. 근데 업데이트 전후로 주점에서 고등급 용병 뽑힐 확률에 변동이 있었던 것 같네요. 어지간하면 모르겠는데 뽑힐 확률 체감 수준이 1/4 토막은 나버리니... 확률 고지 하는게 맞을듯 싶네요,2,2023,3,7
11,까치,전투력 2만정도 되면 한계가 확 느껴지고 이후 단순 노가다밖에 없어서 쉽게 질림. 그렇다고 노가다가 친절한 시스템도 아니고 해봤자 전투력 100씩 찔끔찔끔 올라가며 한개 얻기도 어려운 빨간보석으로 인원수 한칸 올리려고 별로 당장 필요도 없어보이는 치명타확률2퍼짜리 같은 거 다 뚤어야되는데 하는 사람 입장으로 안질리고 배기나 사전예약 할 정도로 기대가 컸는데 진짜 상태가 영... 전 지웁니다,2,2023,3,3
12,BJ Lee,"금화 생산소가 업그레이드가 안되네요. 재료 힘겹게 모으고 부족분은 보석으로 대처해서 업그레이드 시켰는데 자원이랑 보석은 사라졌는데. 금화 생산소는 그대로임... 확인하고 해결좀 해주세요. 그리고 뽑기 시스템으로 유저들 농락하지 말아주세요. 내가 만원 가까이 모아서 한꺼번에 뽑기를 반복적으로 했는데 유저들을 가지고 놀더군요 분명히 브레이크 걸었는데 밀리거나, 심지어는 뒤로 빽이 됨 한두번은 내 실수이겠다 혹은 내가 잘못 느꼈다고 생각 할 수 있지만 회수를 거듭하면서 반복적으로 확인했네요. 뭐 부벌 사용자니, 뭐니 하면서 불량 사용자 잡는다고 광고하지말고.. 유저들한테 사기치지나 말았으면 좋겠네요. 뽑기가 마치 3분의 1 확률 게임인척 사기치지 맙시다.",2,2023,4,30
13,물태건,진짜 무과금으로도 할수있는데 딱거기까지인 게임 다른사람들이 말했던거처럼 초반엔 운이 진짜 좋은거처럼 황금색 케릭터들이 잘나오지만 조금만 지나도 회색케릭터만 뽑힌다 만약에 황금색 케릭터가 운좋게 뽑혀도 바로 과금요소가 나와 날 유혹하지만 아무리 그것을 사도 제자리 걸음.. 그 유혹만 참고 해도 된다..,2,2023,4,3
14,quartz 9,"붉은 크리스탈 수급 부족이 상당히 크게 다가옵니다. 사실상 한정 과금패키지로 얻는게 가장 확실하고, 이것때문에 정말 강해지기 힘들어서 추천하고싶지 않네요.",2,2023,4,20
15,Sh Lee,너무 많이 기대한 것 같다 물량빨로 다니며 물량으로 맞서는 게임인 줄 알았는데 노력만 조금 한 알피지 게임인 것 같다. 그리고 첫 전설빼고는 진짜 놀리는 건가? 절대 전설은 안 걸림 진짜 다시 뽑기 하면은 전설이 나와야 하는거 아닌가? 대충 지금은 재미있는데 하다보면 절대 손 대지 않고 싶은 게임이 될듯,2,2023,3,4
16,오오오,가볍게 하기에 잘만들었지만ㅋㅋ재화수급 안되고ㅋ영끌해도 뽑기 확률은 진짜 극악ㅋ확률부터 표기해줘야할듯..전설은 극초반에 하나 그냥 주는 느낌이고ㅋㅋ그뒤엔 진짜 안나옴ㅋㅋㅋㅋㅋ,2,2023,3,8
17,뉴주,처음에는 재밌다. 뽑기천장을 쳐도 전설을 먹을 확률이 확정도 아니고 극악이다. 재화상자수급 제한 걸어놨다. 힐러못뽑으면 답이없다. = 무과금은 성장이 탁 막혀 흥미를 잃는 게임,2,2023,3,8
18,호박,게임은 재미있다 하지만 뽑기확률 주작이 눈에 띄게 심해서 그건 과금을 위해 어쩔수없다지만 좀 그렇다 어떻게 전설 2개 노말 1개가 있는데 노말말 주구장창 나올수가 있을까? 운도 실력이라면 난 실력도 좋지 않나보다,2,2023,5,8
19,박범수,정체구간 들어가면 체감될 정도로 초반과는 다른 노골적 현금 유도 뽑기확률.. 정체기부터 시작되는 과도한 자원 수급 부족으로 인한 정체기와 과금을 안하면 답이 없어보이는 수급량. 그냥 과금 하지말고 찍먹하고 정체기되면 삭제해라. 과금해도 별 차이 없다. 다른 리뷰봐도 확률 조작 의심 리뷰 많은데 진짜 노골적으로 초반이랑 차이 난다는거 명심해라.. 이거 뽑기 아니면 스펙업 불가능 게임이다,2,2023,3,27
20,Paul Jung,아니 계속 위협감지라고 떠서 플레이 자체를 못하고 있어요!!! 플레이도 못해서 점수 3에서 2로 깎습니다..,2,2023,5,16
21,Cookiemon,게임 하다보면 벽을 느끼는 구간이 나옴. 잡몹한테 무기력하게 썰려나감. 그 때부터는 무한 파밍해서 업글이 답인데 하다보면 질림. ai가 멍청해서 막 가져다 박고 맞고 죽어서 돌아옴. 현질 안하면 이후 클리어 불가임. 벽을 느끼는 곳에서 접으면 되는 게임,2,2023,4,25
22,김형민,게임은 나쁘지않은데 유닛 뽑는게 괴랄하네요 ㅋㅋㅋㅋ 뭐 돈벌려고 현질유도하는거는 알겠지만 적어도 무과금 유저도 살수있는 탈출구라도 말들어주면 참 좋을텐데 아쉽네요,2,2023,3,8
23,subi m,처음에는 과금 조금 하다가 2주일 정도 하고나니 '내가 이게임을 왜 하고 있지?' 라는 생각이듬 즐길거리가 아예 없음,2,2023,4,21
24,김시아,초반에는 전설영웅도 괜찮게 뽑다가 후반엔 조작마냥 가장 낮은 등급만 나옴 근거리영웅이 쓸모가 없고 원거리만 쓰게됨 붉은보석이 수급확률이 너무 낮음 케릭별 스킬 쿨이 길어서 캠프 활성화 하면 압사당함 재화수급은 수월하지만 쓸때가 없음,2,2023,3,28
25,휘게,현질도 어이없게 비싸고 골드 모이는것도 한정적이고 용병 뽑는것도 예상이 가듯이 안좋은 순으로 뽑히고 ... 하긴하는데 실망감이 큼,2,2023,4,5
26,손강섭,소과금했지만 할수록 짜증 업데이트도 느리고 던전보스 불범위피해도 다뒤지고 운영자는 겜해보냐 힐러는 힐을싸울때만해서 짜증,2,2023,3,31
27,JIO TV,광고가 많아요. 그리고 발열이 진짜 심해요. 개선이 필요해보임.,2,2023,4,15
28,박종범,초반에는 뽑기가1/3 확률인줄알았더니 걍 확률차이가넘 심함 과금하긴했는데 넘꼴받게 만듬 이럴거면그냥 가차처럼 하든가 3개 중2개가 금카떠도 1개 일반뽑히는게 수둑룩함 진짜아기자기하고 과금한거 아까워서 라도 좀하다 접을듯,2,2023,3,19
29,조미란,기본적인 무빙조차 렉으로 인해 빙빙돌아 죽기 쉽상이라 무빙 때 버벅거린다면 플레이를 하면 절대 안된다. 뽑기는 99%정도 일반이나 보라돌이만이 뽑히기 때문에 금화가 몇십만골드 이하라면 레전드케릭 3개 다 뜰때까지 기다렸다 뽑아야 한다. 현질유도는 심하진 않고 나름 시간 때우기엔 좋은 게임. 요새 모든 게임이 다 그렇듯 확률은 헬임.,2,2023,3,20
30,Moon star,게임은 단순하고 나쁘지 않은데.. 캐릭터를 뽑고도 랩업을 못해서 진도도 못나간다니 게다가 랩업시스템이 가챠뽑기라니 너무 최악입니다. 그렇다고 확률이 좋은것도 아니고 영웅뽑기실패후 두번째뽑기는 다이아써야되니 그냥 현질해서 뽑으라는거네요 왠만해서는 글안남기는데... 좀 이건 아닌듯합니다.,2,2023,5,11
31,박박박,우선 확률이 진심 너무함 붉은 광석? 이거 진심 던전은 이게 뭔지 내가 못 키워서 못깨는 건지 아니 나무 남아 돌아서 스테이지 열었더니 일일던전 그것만 난이도 오르고 너무 힘들어요 난이도 좀만 내려주세요,2,2023,3,8
32,yongseok kim,"처음이야 재밋지 뒤에는 현질아님 성장 막힘 불친절한게임. 현질하더래도 35부터 이거 깰수는 있는 보스인가 의문,,? 전설 뜨면 뭐함 ㅋㅋ 전설있어도 또 현질해야 조각 받음 ㅋㅋ 출석보상도 없는 아주 노가다 과금러만 즐깅수 있는 겜",2,2023,3,5
33,1,"전설급 캐릭터 확률이 너무 낮습니다 에초에 전설급 한 번 뽑아도, 레벨이 딸려서 안쓰고 말건데, 이건 뭐 천장도 없고 평생해도 전설급 다 못먹을 거 같습니다,,,",2,2023,4,23
34,뽀익이,입은 걸렌데 손은 비단이라 욕을 쓰진 않아요. 만들다만 게임으로 계속 빌어먹고 싶으면 패치라도 똑바로 하세요.,2,2023,3,28
35,김초롱,레벨 풀어주시고 새 맵 좀 뚫어주세요. 할게 진짜 없네..;; 지겨워져서 지울까함.,2,2023,4,14
36,Wonjin Kang,와....광고제거 5900원이었던거 고민하다가 결제하려는데 이틀새 25000원으로 잠수함업데이트 됐네요.....겜접으라는걸로 알겠습니다 ㅜㅜ 수고하세요. -------------------------------------- 재미는있어요 확실히 근데.... 좀 어처구니가없던게 영웅뽑기하는데 전설 뽑을수있게 목록에서 떠있는상태에서...분명히 차례대로 룰렛돌면 전설뽑혀야하는 순서였는데 전설 건너뛰고 일반영웅이 선택더라고요??... 뭔조작질을해놓으셨길래...이런 기만을하시는지... 어쩐지 댓글들도 죄다 전설하나뽑고 안뽑힌단얘기뿐인거보니 확실한거같은데 너무한거아닌가요,2,2023,3,10
37,Slow Ship,이거 주점작은 온라인 도박이랑 똑같음 초반에 주점에서 캐릭터 뽑을 때 전설 확률 올려서 잘 뽑히게 만들고 중후반 갈수록 전설 두 개 나와도 나머지 일반 하나 걸리게끔 해서 보석 현질 유도함 내가 5번 연속 그랬음 자기가 과금러나 돈 아끼면서 오래 해도 지루함을 잘 못 느끼는 사람이면 설치해도 좋음 참고로 폴 세 번 놓쳐서 빡쳐서 리뷰 남기는 거 맞음,2,2023,4,20
38,1 1,재밌긴한데 재화 얻을수있는 방법이 너무 적고 한정적임,2,2023,3,6
39,김정인,확률이 이상합니다 초반에는 전설이 잘뜨더니 후반가니깐 전설이너무 안뽑히네요 어떻게 보석 쓰면서까지2번을 뽑기 했는데도 안뜨고 뭐 운이 없다고 쳐도 어떻게 3번 연속으로 보석 써가며 뽑기 했는데도 안뽑히는건 뭔가여 확률이 어떻게 되는거져?,2,2023,3,19
40,jaehwi Kim,인터넷 오류로 주점 교환권이 다수 사라졌습니다. 이거 안고쳐지나요..,2,2023,3,14
41,Ftgv Yy,"게임 자체는 중독성있다 캐릭터도 아기자기해서 수집욕생기기도 하고. 근데 게임 제작자는 사용자한테 매우 불편한 편의성을 제공( 아이템 분해시 복수 선택 불가, 주점에서 크리스탈 사용시 안내 팝업 없음 )하면서 전설등급 획득시 추가적인 연쇄 패키지 구매 와 상위등급 캐릭터의 매우 낮은 확률같은 불쾌한 BM으로 게임내내 거지같았다. 게임 첫날에 25만원 질렀고, 게임에 월 50정도씩 현질하는 과금 유저지만 여지껏 플레이한 구글게임 중 역대급으로 별로였다. 결론 현질 안 할거면 삭제 ㄱㄱ",2,2023,3,26
42,IRON COIN,우르르란 이름을 달고있으나 현질아니면 빨간보석 드랍이 너무 안되서 우르르가 안됨. 업데이트 이후 주점에서 뽑기시 돌림판이 차이가 느껴질정도로 전설영웅 피해감,2,2023,3,16
43,임일중,게임이 한번 접속했다가 끊고 다시 접속하려고 하면 접속이 안되네요...?,2,2023,3,22
44,섭이 (남자의향기),상당이 잘 짜여져 있는거 같지만 . 운빨망겜 이란 그것은 못 피한. 컨텐츠 가 개발중이라 느리고.. 여기 과금할 돈이면 스팀에서 좋은 게임 40개는 살듯 폰겜 특성 운운 하던데 요즘 앵간 하면 Pc로 하는 분은 그 딴 소리 하지말귀.,2,2023,4,9
45,동키바,재미있나 싶었는데~ 강제 광고는 별로네.,2,2023,3,18
46,sorp,가볍게 할만한 게임이라 생각했지만 현실은 그렇지 않음 컨텐츠를 즐기고 싶으면 과금을 해야하는데 컨텐츠 보상이 쓰레기인 이유좀 알고싶고 뽑기는 1/3확률인것처럼 속여 과금유도나 하고있고 애초에 게임사가 자기들이 뭘 만들고있는지 모르는것같음,2,2023,4,4
47,하하호호,카드 뽑을때 무조건 일반카드 있는데 일반카드만 오질라게 뽑히네 전설카드 절때 안뽑힘 다시 하려면 보석 사야하는데 현질 유도 하시네??,2,2023,4,17
48,김학재,얘네 균열능력치 룰렛돌리는거 잠수함패치한듯,2,2023,5,3
49,이창훈,재미는 있는데 딱1주일 하면 할 콘텐츠가 없음...,2,2023,4,11
50,진구,재미는 있으나 어느순간 난이도가 팍올라 황당하고. 노가다성이 심함. 뽑기도 전설 나올 빈도수도 적근데 뽑을 확률이 주작이라 느껴질 정도로 엄청 안걸림. 고로 삭제,2,2023,3,30
51,Park Jinseo,제공하는 다이아몬드 재화도 너무 적다,2,2023,3,5
52,차지후,제미는 있는데 계속 튕겨서 별 2개입니다 버그 고쳐주세요,2,2023,3,21
53,깜쓰,업데이트쫌해줘요 렙 60제한은 언제푸는거고 겜버리시는거 아니죠?,2,2023,4,14
54,구독1000명 만들어주세요,조작감이 안좋습니다 그리고 빨간크리스탈 안나오는 아이템인가요.?,2,2023,4,18
55,요빠찌빠 (yopha-zzipha),"잘만든게임. 하지만, 뽑기 확률이 33.3%처럼 해놨지만 아님. 공정위에 신고 넣으면 해결해줄거같은 느낌이지만 그 전에 삭제함 ㅇㅇ 게임사는 나한테 고마워해야댐",2,2023,4,26
56,동동산동 (보거스),카드 랜덤뽑기가 진짜 렌덤인지 궁금할정도 입니다. 초반에는 에픽?잘걸리는데 현질 조금하면할수록 골드 아니면 못뽑도록. 렌덤돌리면 안줘요,2,2023,4,5
57,유트브채널용,"이틀은 재밌으나, 뽑기시스템이 영아님 과금구조가 이상해서 굳이 뽑기를 하지않고 게임을 삭제하게됨",2,2023,3,25
58,lob der (하이루),붉은광석 절대로 드랍안됨 영웅 뽑기 확률 극악,2,2023,4,2
59,룰룽,흠.. 이벤트 구성이 좀..,2,2023,4,18
60,jonggoo,후반부엔 현질없이 아예 못해요,2,2023,3,23
61,이재준,초반에 크는 재미가 있음 막히는 순간 막막해짐 할게없음 붉은보석 수급이 어려움,2,2023,4,10
62,흐니,컨텐츠가 적어,2,2023,3,5
63,양현모,뽑기 확률 극혐...,2,2023,4,2
64,백승주,확률 조작 미친 게임ㅎㅎㅎ,2,2023,4,16
65,rex T,던전포탈타고들어가는데 팅기더니 게임실행자체가 안되네요,2,2023,4,6
66,Reznya,전설이 처음빼고는 심각하게 안나옴,2,2023,3,5
67,잼도리,벚꽃은 혈압오르라고 하는 이벤트냐 적당히 안나와야지 두시산을 해도 100개가 안찬다,2,2023,4,11
68,nuyh s,주점 시트템 짜증남 수익을위해 완전한 랜덤은 아닐듯,2,2023,4,6
69,송쿠쿠,저는 왜 영상보기오류뜨죠 제폰이 이상한건가요?,2,2023,5,15
70,곽인호,균열 보상 받을때 광고보고 1.5배 더 얻는 과정에서 버그가 있습니다. 광고 보는 도중 렉 걸려서 게임이 꺼지면 보상이 완전 다 날아가는데 적어도 기존 보상은 들어오게 할 수 없나요? 균열강화석만 낭비하고 보상은 다 날아가네요,2,2023,5,21
71,홍석환,나름재미네ㅠ. 영우 뽑기는. 돈이너무 많이들어 가네ㅠ 불은 보석. 구하기힘들구 현질안하구 쫌,2,2023,5,19
72,이형원,에러 뜨더니 들어가지지를 않아요...,2,2023,5,20
73,김용호,이거 동기화가 이상해요. 갤탭에서 39 렙까지 키웠는데 핸드폰 에서 실행(이건 21렙까지 한 적이 있었음)해보니 39 가 아닌 21 랩이 적용 되있임. 후에 탭에서 재 실행하니 21랩으로 됨;; 구글 동기화 까지 해둔건데... . 매우 큰 현타가 밀려오네요...,2,2023,5,19
74,프테M,너무 재미있게 하고있었는데 어제 업데이트되고 핸드폰으로 업데이트가 안됩니다. 다른폰으로하니 되긴하는데 저장이 안되있어 다 날려서 어찌해야할지 고민중,2,2023,5,19
75,잘때,캐주얼rpg 동료탐험 ㅣ 518 균열반초기화ㅡ재등반현탐 18만골드=신규영웅(6개월예상) 잡전설장비처리편의성ㅡ감별하랴일일히분해 던전재입장이아닌3개치를한번에 ㅡ광고날아감 플레이보상상자획득조건완화 ㅡ걍주으면얻는걸컨트롤해야함,2,2023,5,18
76,Hyo Won Kim,아기자기한 맛이 있습니다 단점은 내 플레이 데이터가 전혀 보호받지 못합니다 게임내 재화로 용병을 뽑고 광고를 보면 게임내 재화도 없어지고 광고의 이점도 없어져요 다른 경우도 마찬가집니다 던전에 갔다오면 입장권도 사라지고 광고로 1.5배 받기한 보상도 없어집니다,2,2023,5,19
77,한별,"광고 제거만 구매해서 이용해봤는데 느낀 그대로 작성해봄. 1. 할만하긴 한데 현질이 없으면 한계지점에 빠르게 도달함 2. 확률공개가 이루어졌으면 함. 뽑기는 3개중 1개를 뽑고, 남은 2개는 현금성 재화(다이아)를 요구하는데 일단 직접 경험해본 바로는 90% 이상의 확률로 일반용사만 뽑히고, 영웅, 전설용사는 다이아를 이용해야만 뽑을 수 있는 구조임 3. 다이아 수급처가 극히 적으며, 얻기 힘든 재화에 비해 다이아로 제공되는 서비스가 가격이 비싸며 내용물도 빈약함. 4. 극초반을 제외한 현금으로 판매하는 패키지 상품도 가치에 비해 비쌈. 꽤나 초반 구간부터 한계에 막히는데, 그걸 돌파하기 위해 제시되는 상품들이 지르는 돈에 비해 리턴값이 미미할 것이라는 결론이 먼저 서는 애매한 상품들 뿐임 게임을 지속할지 접을지 간보는 구간에서 현질 없이는 벽에 막히고, 현금성 상품들의 상태도 가성비가 안좋은걸로 봤을때, 그냥 한탕하고 섭종하려는 게임들이랑 크게 달라보이지 않음",2,2023,5,18
78,ᄋᄋ,밸런스 최악,2,2023,3,7
79,루두누후,과금 유도가 심각하다 재미는 있는편 적당히 하다가 지움 과금할만한 가치는 없어보임,2,2023,5,19
80,올라잇,패치 내용 보고 바로 삭제했음,2,2023,5,20
