,name,reviews,score,year,month,day
95,게임하는사람,귀환포탈 좀 많이 타면 이동하는게 이상해지는 버그가 있습니다 그거 말고는 다 너무 좋아요.,5,2023,4,11
96,KE B,너무 재미있어요! 몬스터들도 귀엽고 용병단 뽑기도 재미있고! 가볍게 하기 좋은 게임이네요,5,2023,3,9
97,잉호,자동! 반자동! 세로! 한손! 언제든지 짬짬이 할수 있는 직장인에게 최고의 갓겜,5,2023,3,4
98,김기성,이 우르르용병단 아이피로 계속 더 다양한 게임이 나와도 좋을거같아요 캐릭터들이 귀엽고개성있네요,5,2023,4,12
99,장민석,간만에 정말 재밌게 하는 게임. 한 가지 아쉬운건 너무 완급 조절을 해서 하루종일할 수 없다는 것.,5,2023,3,31
100,비루,진짜 천천히 즐기면서 할수 있는게임. 힐러가 있어야 사냥이 편해짐. 한동안 이것만하고 살면될듯,5,2023,3,5
101,황황인우,업데이트 인식 오류로 제거후 재설치한뒤 기존 데이터가 날아갔습니다. 구글 계정로그인도 연동이 안되는데 데이터 복구는 어떻게하나요?,5,2023,4,18
102,이성윤,딱 사전예약때 제목만 봐도 너무 재밌어보여 플레이 하니 확실히 재밌네요. 이게임 추천 합니다~♥,5,2023,3,5
103,Gov Kim,아기자기한것이 게임성도 좋고 컨트롤도 쉽고 딱 제 취향이네요,5,2023,5,1
104,조현호,재미있네요 약간 색다른 맛입니다. 방치시간이 1시간이라 좀 아쉽습니다. 캠프시간 늘려주세요^^,5,2023,3,6
105,DAYuK,"게임성더 좋고 재미 있는데 우르르섬 밀고 나면 균열,유령마을 같이 노가다 말곤 남는게 없음 그리고 몇몇 영옹은 성능이 너무 처참해서 버프가 시급함ex) 지젤,바네사 리사",5,2023,5,10
106,인생무상,광고제거 마지막 할인이라더만 진짜 마지막이네 재미 붙어서 광고제거 살려고하니 정가는 너무 비쌈 다시 할인해줘요,5,2023,3,29
107,안효철,잠깐잠깐 플레이하기에 매우 훌륭한 게임. 과금설정도 적당하게 느껴짐.,5,2023,3,26
108,김태환,게임은 너무 재미있는데 재설치햇다가 정보가 날아갓는데 어떻게 복구할수잇을까요 ㅠㅠ,5,2023,4,4
109,O. O놀래미,레벨이라도풀어줘용 겜재밋는데 60렙에서안올라가니 경치없는벚꽃이벤트하는재미도엄꼬 ㅠㅠ 아템은뭐 균열에서얻음된다쳐도..ㅠㅠ업뎃이시급합니다 현기증나요 ㅠㅠㅠㅠㅠㅠㅠ,5,2023,4,10
110,구름슝(구름슝),일단 재미 보장. 확실함. 아쉬운게 우선 장비 분해는 좀 편하게 해주셔야 할듯,5,2023,3,4
111,이정훈,무과금에 관대한 게임. 미안해서 광고제거 사줌. 대신 스킬쿨타임/딜미터 제발 패치좀,5,2023,4,9
112,Jaeyoung Shin,재밌네요 조작도 거의 원터치로 할 수 있어 편하고,5,2023,5,4
113,조정훈,진짜 너무 재미있고 제가 자원을 얻으면서 성장하는 맛이 너무 좋네여⌯' ▾ '⌯,5,2023,3,11
114,준영한,제친구가만들어서했는데 엄청나게재미가있었습니다 일단주점에서3명중한명을뽑는다는게 창의력이대단합니다,5,2023,5,8
115,Being,첨하는데 소소하게 모험 잠깐잠깐 하기 아주 좋은듯 그래픽 너무 귀엽당,5,2023,3,3
116,강동철,생각없이 하기 꿀꿀 과금은 게임을 좀 더 편하게 해줌 무과금이어도 시간만 많으면 됨,5,2023,3,3
117,Sara Sam,재미는 있지만 빨간 수정 드랍률좀 올려주시고 전걸까지는 안바라지만 영웅급 영웅들좀 잘 뽑히게 해주세요 ㅠㅠ,5,2023,4,2
118,총기수리병,광고제거도 5000원밖에안하고 소과금으로 소소하게 즐기기좋아요! 케릭도 귀엽구여ㅋ,5,2023,3,20
119,마노mano,캐릭터들이 누가누거가 딜을 잘 넣는지 던전에서 딜량이 나오면 좋을것같음요,5,2023,4,30
120,자연산 민달팽이,캐뷰얼 하면서 많은 시간 투자하지 않아도되는 갓겜 현질하지 않아도 풀 도감 가능 맛 한번 보러오세요 ~,5,2023,3,22
121,내약사갈매기,괜찮네요 좀 더 컨텐츠가 더 많으면 좋겠구 멀티기능까지 있으면 좋을거 같아요,5,2023,4,1
122,자몽,간만에 신선하고 재밌는 게임이 나왔네요~ 푹 빠져서 시간가는줄 모르고 하고있어요,5,2023,3,5
123,정재봉,캐릭터도 귀엽고 사냥하는 느낌도 들어서 아주 좋습니다. 강추합니다.!!,5,2023,3,3
124,임둘리,모바일 수동조작의 최적화. 귀찮지 않은범위의 수동조작겜,5,2023,3,5
125,정종일,잘못결제후 환불했는데 4일넘게 아이템 회수안해가셔서 게임을즐기기가넘불편해요 빠른처리부탁드려요,5,2023,4,24
126,김시온,케릭터들이 너무 귀엽고 재밌게 하고 있습니다 이런게임 많이 나오면 좋겠내요,5,2023,4,9
127,박재현,아쉬운게임이네요 이런게임중 광고게임제외하면없지만 재밌게하는데 개발사에서 성공히른데 이런식읃르 대처하는지 잘키워놓고 망겜 만드는이유가먼지 물들어왔을때놓저으세요 언타카운마음에얘합니다,5,2023,4,5
128,Nosferatu Akad,"1. 던전 반복사냥 기능을 원합니다. 40장이 있는데, 40번을 누르는것은 좀 힘듭니다.",5,2023,4,27
129,김길준,재미있어요 // 업데이트 링크 클릭해도 무한 로딩만 계속 걸려요 업데이트 내용 다른곳에도 올려주세요 보고싶어요,5,2023,4,11
130,동탄펜싱클럽,뽑기는 그냥 운이 좋다 나쁘다 수준이 아니라 기대조차 안됌 안뽑힐거 아니까 확률고지도 없고 중요재화 붉은보석은 그냥 구경도 못함 용병 조합은 키우고 싶은걸 키우는게 아니라 계정신께서 점지 해주시는거 조합이 구리던 말던 써드려야함 하지만 개선 해줄꺼라고 믿어보고 5점 넣어봄,5,2023,3,10
131,jsey jang,조작법도 쉽고 누구나 간단하게 즐길수 있는게임인듯,5,2023,5,14
132,모허,재미있었는데 재미없어지는게 너무 빠름.. 아깝다 좀만 신경쓰면 갓겜각인데...,5,2023,3,6
133,sangwon park,과금 유도가 있기는 하지만 없이도 충분히 재밌는 게임이네요,5,2023,5,4
134,권승호,은근히 과금을 유도하지만 무과금도 시간만 투자하면 재미있게 할수있습니다,5,2023,3,29
135,오수환,초밥에는 재미있으나... 현재 업데이트가 시급하다... 할게없음,5,2023,3,24
136,순심이,돈주고 해야할듯 아기자기한 그래픽 창이적이고 던전도 탐색 하고 캐릭터 모으고 젤다에 전설 하는 느낌 입니다,5,2023,3,5
137,jh son,너무 재미있게 플레이하고 있습니다 뽑기도 잘뽑히고 너무 재미있어요,5,2023,3,25
138,부오부오,대단히재밋음 광고제거만으로 재미잇게 모든컨텐츠 다즐길수잇어요,5,2023,4,23
139,이태규,개발자님 다 재밌는데 추가사항이 있습니다 캐릭마다 딜량표시가 있었으면 합니다,5,2023,4,5
140,조우현,재미있어요 ㅎㅎ 아기자기한 그래픽에 사운드도 마음에 들고,5,2023,5,2
141,최재표,아주 단순하게 게임을. 즐길수 있습니다,5,2023,5,1
142,임태균,즐겁다. 광고제거만 해도 할만함,5,2023,5,8
143,조모씨,제가 원하는 한손으로 재밌게 즐길 수 있는 알피지 게임이네요.,5,2023,5,6
144,황명선,케릭터가 아기자기해서 재미있어요 방치형게임이 아니고 직접 컨트롤 하는 재미가 있네요,5,2023,3,3
145,강동규,게임은 재미있는데 조금전에 12000원짜리 힐러영웅 패키지 구매했는데 안들어왔어요 확인해주세요,5,2023,4,9
146,Ju Tam,생각이상 재미잇네 광고도 적당히있고 방해할수준도아니고 밸러스도 다잇어서 재미짐 콘텐츠가더늘어나면 좋겟음 강추 캐릭터 카드모우는재미,5,2023,3,14
147,검볼앤던전쿠우,광고제거만 필수고 무과금도 할만하고 재미있어요,5,2023,3,24
148,강병준,패키지가없다 오픈월드같긴한데 직선형이다 생각보다 무료뽑기잘된다 근데 업글단위가 높다,5,2023,4,8
149,이경산,재미있는데 과금이 금액이 너무쌥니다 차라리 소액과금을 광고보는거 대신하는걸 추천해드립니다.,5,2023,4,4
150,SG J,노다가도 필요한게임이지만 한시간안에 숙제컷 되서 시간은잘가서 좋네요,5,2023,3,16
151,김기숙,"뽑기하는 맛이있고, 맵보는 재미도있어요",5,2023,5,5
152,김관호,만랩찍고 루즈해졌었는데 딱 맞게 업데이트해주신것 같아 2주는 더 할수 있을것같네요,5,2023,4,19
153,염경민,캐릭터도 귀엽고 아주 잼있네요,5,2023,5,1
154,남매,시작한지 1신간만에 절설 캐릭을 얻어 되게 수월하게 플레이 가능하고 되게 재밌어요,5,2023,4,17
155,전호철,재미있어요 ㅜㅜ 단 하나의 단점 ~~터치 이동 추가 안될까요!!!!!!!!!!,5,2023,3,4
156,장태원,무과금으로도 쉽고 재밌게 즐길수있는 몇안되는게임 같습니다^^,5,2023,4,5
157,카네브로스,업데이트좀 해줘요... 공들여놔서 계속 하고싶은데 더이상 할게없네...,5,2023,4,14
158,박률,초반에 광고제거 못샀는데 할인 기간이 너무 짧아요 ㅠㅠㅠ 광고제거 할인 이벤트좀.....,5,2023,3,17
159,철이,광고제거만 사면 적당한 밸런스에 할만 합니다 추천드려요 +광고제거 현질 정도는 할 만합니당 만든사람도 먹고 살아야죠,5,2023,3,5
160,이진우,3시간정도 해봤는데 정말재밌네요 ^^ 혹시 친구와 같이 할수있는 그런 시스템이 나오나요? 나오면 훨재밌게 친구들과 할수있을거같네요!,5,2023,3,3
161,김상태,너무 좋고 뽑기 잡기 진도나가기등 너무 좋아요 강추합니다!!!!!!,5,2023,4,30
162,케이댄스학원K Dance Academy,"재미는 있는데, 광고 보기 실패가 계속 뜨네요.",5,2023,4,15
163,pdd0905,아이템 잠금좀 추가해주세요 실수로 분해하기 너무 쉽네요,5,2023,3,9
164,도널드맥,최근해본게임중엔 꽤 괜찮은 게임인거같네요 광고도없구여,5,2023,3,13
165,태풍이태양이,재밋어요 킬링 타임 최고인데 뭔가 성취하고 싶기도해 ㅋㅋㅋ,5,2023,4,7
166,minz,굳이 돈안써도 지금 나와있는 필드 컨텐츠 끝까지 가능 오히려 뽑기 문제보단 컨텐츠 부족이 큼 그러나 컨텐츠만 받쳐준다면 진짜 잘만든 겜,5,2023,3,23
167,ᄌᄒ,내 모바일게임역사상 이렇게 광고없는 게임은 오랜만 현질유도도 없음,5,2023,3,27
168,서성은,시간만 되면 현질안해도 재밌게 할수있는 게임이네요ㅎㅎ,5,2023,4,5
169,권기범,쓸데없이 노잼 컨텐츠 새로 만들지말고 렙제한이랑 막힌 던전이나 뚫어주면 좋겠습니다,5,2023,4,8
170,문파람,처음부터재밌네요 단순하면서도흥미있고일단지금은재밌음,5,2023,3,4
171,김경환,완전 재미 있습니다. ㅋㅋㅋ 한번 해보세요 최소 한달은 밤새요~,5,2023,4,27
172,동동 (RIO),완전 재미 있어요 기본 과금을 안할수가 없네요,5,2023,4,22
173,김경환,굿이요. 시간죽이기 좋을듯. 애들하고 같이하기도 좋아요,5,2023,4,24
174,kuuma,재밌음~ 겜에 많은 시간을 투자 안하는 저한테는 딱 맞네요,5,2023,4,25
175,Hanel,초반은 재밌는데 후반 갈수록 좀 힘들어지네요ㅠㅠ,5,2023,3,9
176,Eric Lee,재미있습니다. 아기자기 귀여워용,5,2023,4,30
177,빈이,참 재미있는 게임입니다 좀 더 많은 컨텐츠가 생겨났으면 좋겠어요 나온지 얼마 되지않은 신작게임이니 앞으로 나올 컨텐츠들 기대하겠습니다 !,5,2023,4,10
178,김민수,"저혹시 광고제거할인 한번다시주실수있나요; 하다보니까 재밌어서 사려는데 25,000은 너무비싸요 ㅠ",5,2023,3,29
179,Daddy Bear,역대급 재미다. 추억의 알피지 느낌 갓겜이네요. 아기자기하고 귀엽고 모으는 재미있공 강추,5,2023,3,24
180,문경민,확률도 좋아서 좋은거 잘 나오고 게임 시스템도 재밌어요,5,2023,3,9
181,Lirad Daril,"오, 아기자기한 캐릭터와 간편한 조작감이 만족스럽습니다.",5,2023,3,6
182,호순이,진짜 요즘 할게임 없는데 와 스팀에 팔아도될정도퀄리티도 좋고 재밌어서 꼭 한번 해보는거 추전함,5,2023,3,25
183,부릉,캐릭터들이 아기자기해서 귀여운데 스킬보는 맛도 있고 재밌네요,5,2023,3,28
184,신종호,아기자기한 케릭터 모형과 적당한 난이도. 좋네요,5,2023,4,10
185,_이상한꼬마,재미있어요 아직 초반이지만 열심히 키우는중입니다,5,2023,4,16
186,절루가랏,재미있어요 조작 쉽고 간단하면서 수집도있고,5,2023,3,25
187,윤땡땡 (집섭),개꿀잼입니다. 현질유도도 적어요 광고제거맘 해도 개꿀,5,2023,3,5
188,배진모,컨테츠가 조금 부족하지만 재미있어요. 업데이트 기대 중입니다,5,2023,4,6
189,ks2a21@naver.com김만수,무과금도 골드노가하면 주점에서 충분히 뽑기가능해서 좋네요,5,2023,4,20
190,ᄇ박샛별,너무 재밌어요 게임 잘 몰라도 퀘스트 따라 하다보니 빠지게 되네요,5,2023,3,4
191,J in,광고제거만 구매하고 즐기셔도 충분합니다,5,2023,3,18
192,SSAPI TV,와 진짜 처음엔 진짜 재미있어요! 후반도 그럭저럭 재미있어요!!,5,2023,3,16
193,정철원,현재 균열 및 던전 입장 관련 버그가 있는데 대처방안을 요구 합니다,5,2023,4,4
194,duo man,아기자기하고 재미있네.BM도 맵지않은 순한맛이고..,5,2023,3,3
195,주니곰,중독성 갑!!!! 아기자기 ㅈㅐ미있음. 처음시작해서 3시간째 하는중,5,2023,3,29
196,강춘호,초반에는 극재미 만렙찍고는 30분마다 숙제하는 개지루한게임,5,2023,4,5
197,김남균 (ryan9kim),아기자기하면서 간단한데 있을건 다 있네요 ^^,5,2023,3,23
198,함양LS얀마농기계,30살입니다 쌍둥이키운다고 게임 일체안하는데 인스타보다가 우연히 보고 깔아서 너무 재밌게하는중입니다.,5,2023,4,13
199,미스터케이TV,와 나이먹고 심심해서하는데 굉장히 재미있네요,5,2023,3,17
200,마슴게차,시간 가는줄 모르겠네요 아기자기하면서도 재미있습니다.,5,2023,3,3
201,김창현,제미나게 잘 하구 있습니다 광고제거만 하면 진짜 할만해요 ㅋㅋㅋ,5,2023,3,13
202,권승현,완전 재밌습니다. 동료들 모아서 모험하니까 완전 재밌네요.,5,2023,3,7
203,u kyeom kim,캐릭터들이 너무귀엽고 재미있네요 게임도쉽고,5,2023,4,1
204,김현식,잼있네요 계속 손으로 잡고 있어야하는게 단점,5,2023,4,2
205,Donyeong Kim,캐주얼한 디아블로같아요 잼나네요~ 근데 맵을 볼수있게해줌 더좋을꺼같아요,5,2023,4,15
206,양성모,게임도 재밌고 터지는 느낌이 짜릿햇어요! 이런 게임이 갓 겜이라고 말합니다^^,5,2023,4,5
207,낭천,"혜자겜 재밌음, 폰게임중엔 두번째로 오래하고 있는듯",5,2023,4,5
208,김수수한수,이거 중독성 있네 과금유도 많이 없고 편하게 끄기 딱좋네요,5,2023,3,5
209,wickedloves,카페는 힘들더라도 라운지라도 있으면 좋겠어요 정보 얻기 힘드네요,5,2023,3,24
210,조영호,재밌는데 유저와 소통이나 패치사항에 미리 공지해줄수 있는 공식 카페가 필요합니다.,5,2023,4,4
211,권씨집안,광고가 많지만 가만하고도 잼있음,5,2023,4,18
212,황규산,광고제거만 사고 하기에도 딱 괜찮은 게임,5,2023,3,24
213,한승주,뽑기할때 진짜 등급상관없이 3분의1 씩 이여서 너무좋다,5,2023,4,6
214,유주현,중독성이 장난아니네요!! 아직까진 재밌게 하고 있습니다~~,5,2023,3,5
215,코끼리TV,광고제거를 샀는데 적용이 안됩니다 메일을 보냈지만 묵묵부닥 얼른 처리해주시던가 환불해주세요,5,2023,4,20
216,고한나,캐릭터가 아기자기하고 귀엽고요 조작도 간편하고 직관적입니다. 운영자분들이 컨텐츠 계속내주시고 피드백도 잘 받는편이며 현질유도를 하긴 하는데... 사실 광고제거만 사도 충분히 즐길 수 있긴 해요ㅋㅋ 그러다 욕심나면 조금씩 질러도 괜찮고요!,5,2023,5,11
217,쭈욘남,캐릭터 너무 귀엽고 재밌습니다 취저...,5,2023,3,11
218,박준호,아기자기 귀엽고 쉽고 재밌음,5,2023,5,1
219,5959,너무 재미있어요 캐릭터 뽑기도 돈 안들어서 좋아요,5,2023,3,14
220,몽몽,재밌음! 광고도 적음!!!,5,2023,3,4
221,호로효이,재미있어요! 단순한데 계속 붙잡게 됨,5,2023,3,3
222,007,미니맵 있으면 길찾기 편할거 같다.,5,2023,3,4
223,정ᄌ후,진짜 오래 기다린 보람이 느껴지는 게임이다 완전 강추!!,5,2023,3,3
224,조인해,간단한데 귀엽고 재미있음ㅎㅎ,5,2023,3,30
225,Obfsefgj Ytejib,시간가는줄모르고 푹빠져듭니다 재밌습니다,5,2023,4,4
226,Hn C,힐러 만들기가 어렵긴한데 하다보니 계속하게 되네요,5,2023,3,9
227,김용강,단순하고 영웅모집 재밌네요,5,2023,3,28
228,서머4,솔직히 잘 만들었어요. 디자인도 좋고 아이템도 좋고. 그러니까 개발자님들 꼭 이 게임 살려봅시다. 유저들이랑 소통 하면서 편의성이랑 니즈들 개선해 나가면서 수익 모델 조금씩 늘려가면 서로 베스트일것 같네요,5,2023,3,30
229,Rolist,기꺼이 리세마라 하게 만드는 수작. 근데 캐릭 확정 선택으로 먹을 방법이 있으면 진짜 부족함 없었을 듯,5,2023,3,7
230,차차tv,재밌고 조작이 쉬워요,5,2023,5,15
231,김동욱,심플하면서 중독되네요 매우 재미있습니다,5,2023,4,8
232,yoo sch,이지 플레이 하드 마스터에 충실한 게임. 스트레스도 적고 가볍게 하기 매우 좋습니다. 근데 버그는 많네요. 결제 하고 싶어도 왜 안 되누,5,2023,3,9
233,케인인님한판해요,귀엽고 간단함 쉬움 완전 노가다www,5,2023,3,3
234,강인모,아기자기하고 시간날때 부담없이 즐길수있습니다,5,2023,3,12
235,최유진,"아기자기하고 캐릭 이쁘고, 이상하게 잼나요.",5,2023,3,12
236,Lee Sk,다양한영웅과 깔끔한 그래픽!,5,2023,3,3
237,하세용,광고제거로 충분한플레이가능,5,2023,3,19
238,Seunghoon Lee,부담없고 캐릭터도 귀여워 재밌네요ㅎㅎ,5,2023,3,28
239,이상률,시원시원하네요 라이트하게 즐기기 딱입니다,5,2023,3,7
240,좋아만두,필드 사냥에서 금화 수급이 거이 불가능 해서 사냥에 대한 메리트가 없음 고기랑 나무는 가득차서 그냥 버리고 경험치나 간신히 먹는수준 퀘스트가 너무 없음,5,2023,3,24
241,Super Wondo,"업데이트 나오면, 최신 업데이트 먼저해야 게임 접속되게 좀하세요 매일 게임 할거 다하는 유전데 업데이트 이벤트를 놓치는게 말이 됩니까 유저가 매일 겜하기전에 구글스토어 일일이 들어가봐야 하는게 맞나요? 매일 게임 몇시간씩 하는 사람이 이벤트 손해봐야하는게 맞나요?",5,2023,4,30
242,Sangwoo Hwang,초반이지만 아직 재밌게하고있습니다 오래할거같네요!,5,2023,3,3
243,캡틴노스페로우,오 스피드하면서도 귀여운,5,2023,5,15
244,정대윤,+ 재미있음 무과금 소과금 친화 단순함 귀여움 - 고티어 영웅 적음 한정적인 조합 근거리 용병 카이팅불가 (선이동 후행동),5,2023,3,5
245,김시우,일단 재미있게시작하는중입니다 영웅전설잘주내요,5,2023,5,2
246,김중민,너무 재미있게 플레이 할수있을 것같아요,5,2023,4,14
247,강인구,광고제거 하고 인게임 제화수급 가능 즐겜중,5,2023,3,20
248,안혜진,아기자기한그림 영웅들 모아 모험하는게 너무 재밌어요,5,2023,3,18
249,윤장우,시간가는줄몰르고 하는게임 너무 재밋어요,5,2023,3,26
250,버그,업적만들어줭!업적만들어줭! 업적 보상 만들어줭!업적보상 만들어줭!,5,2023,3,16
251,목이,짜릿한 쾌감은 없지만 시간가는줄 모름,5,2023,3,29
252,사랑여누,무과금은 광고 엄청봐야 됨,5,2023,4,6
253,김성훈,재미나네요 아기자기하고 성장시키는 맛도있고,5,2023,3,24
254,백영철,너무너무 고마워 정말 재미있게 하고있어요,5,2023,3,14
255,짱재,"패치할수록 더 만족스럽네 마을수호 스킵, 딜 미터기 추가되면 더욱 갓겜",5,2023,3,29
256,김엽,과금유도가 좀 있지만 재미있음,5,2023,5,5
257,잉어,소소하게 즐기기 좋아요,5,2023,5,1
258,신정환,아기자기한 캐릭터들로 이루어진 파티를 이끌고 스토리를 진행한답니다 취향저격이에요^^강추해요!!,5,2023,5,2
259,이기웅,확률도 좋고 재밌어요,5,2023,5,4
260,Seohoo Kate VMA,단순간단쉬움,5,2023,5,8
261,전성빈,간단하고 재밋어요,5,2023,5,6
262,Minah Kim,너무너무너무 재미있어요.,5,2023,5,4
263,최현욱,시간때우기 너무좋은게임,5,2023,5,3
264,로또1등되어라,간만에 괜찮은 게임 찾았네요 좋아하는 RPG임당,5,2023,5,15
265,강채영,광고제거 구입하였습니다 적용되지 않고 돈만 나갔습니다 어째서... 문의도 보내보았지만 아무일없습니다 __________________________________ 우편으로 구매상품 다시 보내주셨습니다 게임 아기자기하고 재밌습니다^^b,5,2023,3,22
266,병아리마쿠,광고제거하니까 너무 즐겁다,5,2023,3,29
267,김대현,간단히 즐기기 좋고 귀여워요,5,2023,3,10
268,비사이로막가,재미있음 근데 빨간보석 안나와서 재미없어지면서 걍 지움,5,2023,4,20
269,김재민,개선점 추가.... 케릭별 dps좀 볼수있게 패치해주세요,5,2023,3,26
270,남진재,나우재미있고확률이너무좋아요,5,2023,4,26
271,버들씨,현질 안해도 좋은 영웅 잘뜨고 재밌어요 ㅎㅎㅎ,5,2023,3,23
272,김형주,아직까지 너무 잼나네요 조금만 더해보고 다시 쓸께요,5,2023,3,27
273,최재호,아기자기하게 향수를 불러일으키는 게임입니다,5,2023,5,17
274,pong quu,와 이거 그림체도 귀엽구 쉬워서 중독성 있어요 꿀잼,5,2023,3,5
275,zz z,지금 사용안하는 영웅들은 마을을 돌아다닌다던가 그렇게 하면 더 좋을거 같네요,5,2023,4,8
276,진영율파파,초반인데 잼나요 광고제거는 필수로 사시길,5,2023,3,6
277,fact core,오랜만에 찐으로 재밌는 게임이네요,5,2023,3,20
278,이진우,완전히 추천합니다 한번해보세요!!,5,2023,5,10
279,김새롬,너무 캐릭터가 귀여워요,5,2023,3,4
280,김상후,잼있습니다만 가챠확률은 극악입니다. 전설이 나와도 걸릴확률이 1/3이 아니라 그냥 등급낮은게 걸린다고 보시면 됩니다. 현질로 보석 구매해서 재뽑기를 하지않는 이상은 가챠는 답이 없습니다.,5,2023,4,4
281,이상민,아기자기하고 재미있습니다 판타지 좋아하는분이라면 추천,5,2023,3,17
282,이운영,재미있음 다들 바라는게 많아서 그런가 별점이 적은데 무료게임 이 정도면 훌륭함,5,2023,4,21
283,박자성,재미있게 즐기고 있습니다 5별 박습니다!,5,2023,3,16
284,Esder Bae,너무 재밌어서 미치겠네,5,2023,5,13
285,최선,소소한 재미가 상당한 게임이네요.,5,2023,3,12
286,Matias,이런 스타일의 게임은 처음인데 간편하고 재미있네요ㅋㅋㅋ,5,2023,3,4
287,장현준,광고제거만 샀는데 현 랭킹 31등 갓겜,5,2023,4,26
288,이상협,레벨 한도 좀 올려 주세요ㅠ 할게 없어요ㅠ,5,2023,4,27
289,gw park,계속 현질하게 되지만 할만함,5,2023,3,9
290,오대오,광고제거사고 잠깐잠깐 놀만함. 재미남. 카페에서 정보얻어야함,5,2023,4,1
291,김기홍,기대없이 다운받았는데 기대이상 입니다. 결투장 만들생각은 없으신가요?,5,2023,4,6
292,jea yeon Lee,너무 재미있게 했어요!!,5,2023,5,6
293,HyeBin Kim,쉽고 시간가는줄 모름,5,2023,3,9
294,AHN나리,재밌네.. 볼륨 늘려주는 게임이깅,5,2023,3,12
295,정현식,흥겜>똥겜>갓겜 이번 업뎃으로 개재밌어짐 ㅋㅋ 컨텐츠도 많고,5,2023,4,19
296,Mister좀비,꿀잼 간편하고 재미있게 가능해요,5,2023,3,23
297,바람과같이,소소하게하기에 좋습니다!,5,2023,3,20
298,hel lo,저장소는 50레벨이 끝인가요? 분해재료 고급은 사용처가 없나요?,5,2023,3,30
299,엣환,"개재밌네요, 40대 아재도 재밌습니다",5,2023,4,9
300,썸머형,잘만들었네요~ 아기자기하니 재밌습니다!!,5,2023,3,3
301,이승원,재미있네요 광고 스킵 다시 할인 이벤트 안되나요?,5,2023,3,20
302,YUJA'ᄉ',재밌지만 컨텐츠가 한정적이다,5,2023,4,12
303,김대진,기존계정 연동인가요? 서버가 분리안돼면... 출시라고하기에는...,5,2023,3,3
304,hyun-suk yoo,소소하면서 즐겁네요ㅋㅋ,5,2023,3,25
305,정원덕,아기자기한데 시간 후딱지나가게 하네요.. 일해야되는데...,5,2023,3,3
306,Peter,게임 구성이 깔끔함,5,2023,3,12
307,송진호,잼남니다 디아2와 탕탕 섞어놓은듯한 재미가있네요,5,2023,3,8
308,임진혁,초기 몇만원정도는 투자해야 편하긴 한데 오래본다면 광고제거만 사도 괜찮을듯,5,2023,4,2
309,신현웅,캐주얼하게 즐기기 좋은 게임이네요!,5,2023,3,12
310,나나,아기자기한개 너무재미서요,5,2023,3,5
311,이승현,개꿀잼인데요??? 쉽고 재밋음,5,2023,3,6
312,강BH,단순한데.잼있어요,5,2023,3,19
313,강태원,오랜만에 진짜 재밌는 게임이네요,5,2023,3,5
